EDIT_8-K_2023-06-15_0001558370-23-011141,EDIT,2023-06-15T20:30:28+00:00,financing,EDIT completed equity offering candidate from source document.,completed_equity_offering,capital_raise_dilution,sec_primary_filing,https://www.sec.gov/Archives/edgar/data/1650664/000155837023011141/edit-20230614x8k.htm,after_close,unknown,negative,medium,0.5,,"Capital-raise parser candidate; review transaction-vs-capacity classification, offering size, price, source timing, and market-cap context before modeling.",EDIT_8-K_2023-06-15_0001558370-23-011141_edit-20230614x8k;EDIT_8-K_2023-06-15_0001558370-23-011141_edit-20230614xex1d1;EDIT_8-K_2023-06-15_0001558370-23-011141_edit-20230614xex5d1;EDIT_8-K_2023-06-15_0001558370-23-011141_edit-20230614xex99d1;EDIT_8-K_2023-06-15_0001558370-23-011141_edit-20230614xex99d2,20,10.0,0.86,"(Nasdaq: EDIT), a clinical-stage genome editing company, today announced the pricing of an underwritten offering of 12,500,000 shares of its common stock at a public offering price of $10.00 per share, before deducting underwriter discounts and commissions and estimated offering expenses",125000000.0,0.88,Gross proceeds from the offering are expected to be approximately $125 million,completed_equity_offering,0.87,public common-stock offering transaction language,common_stock,0.86,common stock/share language,125000000.0,0.84,Gross proceeds from the offering are expected to be approximately $125 million,12500000.0,0.84,"(Nasdaq: EDIT), a clinical-stage genome editing company, today announced the pricing of an underwritten offering of 12,500,000 shares of its common stock at a public offering price of $10.00 per share, before deducting underwriter discounts and commissions and estimated offering expenses",125000000.0,gross_proceeds,0.88,10.0,True,False,True,False,False,"and the Company will not directly or indirectly use the proceeds of the offering of the Shares hereunder, or lend, contribute or otherwise make available such proceeds to any subsidiary, joint venture partner or other person or entity (i) to fund or facilitate any activities of or business with any person that, at the time of such funding or facilitation, is the subject or target of Sanctions, (ii) to fund or facilitate any activities of or business in any Sanctioned Country or (iii) in any othe",0.7,"and the Company will not directly or indirectly use the proceeds of the offering of the Shares hereunder, or lend, contribute or otherwise make available such proceeds to any subsidiary, joint venture partner or other person or entity (i) to fund or facilitate any activities of or business with any person that, at the time of such funding or facilitation, is the subject or target of Sanctions, (ii) to fund or facilitate any activities of or business in any Sanctioned Country or (iii) in any other manner that will result in a violation by any person (including any person participating in the transaction, whether as underwriter, advisor, investor or otherwise) of Sanctions",117200000.0,0.82,"The Company estimates that the net proceeds from the offering will be approximately $117.2 million, or approximately $134.9 million if the Underwriters exercise in full their option to purchase Option Shares, in each case after deducting underwriting discounts and commissions and estimated offering expenses",,,,,,,,,,,,,,,,2023-06-15,9.279999732971191,0.0775862379037251,68995606.0,640279205.2561855,0.1811709574664798,0.1952273304737198,,,-0.0343392232565548,0.0659152081563034,-0.1002544314128582,0.1527949705705591,0.1095233825003183,0.0432715880702407,ok,sec_companyfacts_dei,https://www.sec.gov/Archives/edgar/data/1650664/000155837023008308,2023-04-28,2023-05-05,0.82,reviewed,rule_reviewed_timestamp_repaired_clean_slice,has_evidence,agent_2l,2026-05-23,,Rule-reviewed completed financing candidate; requires human spot-check before modeling.,agent_2c_base,,,,completed_common_stock,data\events\capital_raise_enriched.csv,2023-06-15T20:30:28,2023-06-15T20:30:28+00:00,,2023-06-15T20:30:28+00:00,sec_acceptance,sec_acceptance,unknown,after_close,after_close,0.95,ok,,ok,primary,cr2l_0052,,True
ENVX_8-K_2024-11-01_0001193125-24-249316,ENVX,2024-11-01T13:16:59+00:00,financing,ENVX completed equity offering candidate from source document.,completed_equity_offering,capital_raise_dilution,sec_primary_filing,https://www.sec.gov/Archives/edgar/data/1828318/000119312524249316/d904885d8k.htm,before_open,unknown,negative,medium,0.5,,"Capital-raise parser candidate; review transaction-vs-capacity classification, offering size, price, source timing, and market-cap context before modeling.",ENVX_8-K_2024-11-01_0001193125-24-249316_d904885d8k;ENVX_8-K_2024-11-01_0001193125-24-249316_d904885dex11;ENVX_8-K_2024-11-01_0001193125-24-249316_d904885dex51;ENVX_8-K_2024-11-01_0001193125-24-249316_d904885dex991;ENVX_8-K_2024-11-01_0001193125-24-249316_d904885dex992,23,9.22,0.86,"(the “Underwriter”), relating to the issuance and sale (the “Offering”) of 10,416,667 shares (the “Underwritten Shares”) of the Company’s common stock, par value $0.0001 per share (the “Common Stock”), at a price per share of $9.22 to be paid by the Underwriter",100000000.0,0.88,The gross proceeds from the Offering are expected to be approximately $100 million before deducting underwriting discounts and commissions and estimated offering expenses payable by the Company and assuming no exercise of the Underwriter’s option to purchase additional shares,completed_equity_offering,0.87,public common-stock offering transaction language,common_stock,0.86,common stock/share language,100000000.0,0.84,The gross proceeds from the Offering are expected to be approximately $100 million before deducting underwriting discounts and commissions and estimated offering expenses payable by the Company and assuming no exercise of the Underwriter’s option to purchase additional shares,10416667.0,0.84,"battery company, today announced the pricing of an underwritten public offering of 10,416,667 shares of its common stock for total gross proceeds of $100 million before deducting underwriting discounts and commissions and estimated offering",100000000.0,gross_proceeds,0.88,9.22,True,False,True,False,False,"and the Company will not directly or indirectly use the proceeds of the offering of the Offered Shares hereunder, or lend, contribute or otherwise make available such proceeds to any Subsidiary, joint venture",0.7,"and the Company will not directly or indirectly use the proceeds of the offering of the Offered Shares hereunder, or lend, contribute or otherwise make available such proceeds to any Subsidiary, joint venture",,,,,,,,,,,,,,,,,,,2024-11-01,9.03499984741211,0.0204759441850882,177977204.0,1608024010.982834,0.058528096665683,0.0621881261206288,,,-0.2394781346483763,-0.0033858751559106,-0.2360922594924657,-0.2420302189946639,0.0794147825675406,-0.3214450015622045,ok,sec_companyfacts_dei,https://www.sec.gov/Archives/edgar/data/1828318/000182831824000233,2024-10-28,2024-10-30,0.82,reviewed,rule_reviewed_timestamp_repaired_clean_slice,has_evidence,agent_2l,2026-05-23,,Rule-reviewed completed financing candidate; requires human spot-check before modeling.,agent_2c_base,,,,completed_common_stock,data\events\capital_raise_enriched.csv,2024-11-01T13:16:59,2024-11-01T13:16:59+00:00,,2024-11-01T13:16:59+00:00,sec_acceptance,sec_acceptance,unknown,before_open,before_open,0.95,ok,,ok,primary,cr2l_0054,,True
EWTX_8-K_2022-09-14_0001104659-22-100078,EWTX,2022-09-14T21:03:27+00:00,financing,EWTX completed equity offering candidate from source document.,completed_equity_offering,capital_raise_dilution,sec_primary_filing,https://www.sec.gov/Archives/edgar/data/1710072/000110465922100078/tm2221772d4_8k.htm,after_close,unknown,negative,medium,0.5,,"Capital-raise parser candidate; review transaction-vs-capacity classification, offering size, price, source timing, and market-cap context before modeling.",EWTX_8-K_2022-09-14_0001104659-22-100078_tm2221772d4_8k;EWTX_8-K_2022-09-14_0001104659-22-100078_tm2221772d4_ex1-1;EWTX_8-K_2022-09-14_0001104659-22-100078_tm2221772d4_ex5-1,11,10.32,0.86,The offering price of the Shares to the public is $10.32 per share,,,,completed_equity_offering,0.87,public common-stock offering transaction language,common_stock,0.86,common stock/share language,,,,11627907.0,0.84,"relating to the public offering of 11,627,907 shares of the Company’s common stock, par value $0.0001 per share (the “Underwritten",120000000.24,shares_offered_x_price_per_share,0.78,10.32,True,False,True,False,False,and the Company will not directly or indirectly use the proceeds of,0.7,and the Company will not directly or indirectly use the proceeds of,,,,,,,,,,,,,,,,,,,2022-09-14,10.470000267028809,-0.0143266727032639,49799597.0,521401793.8879271,0.2334939979534372,0.2301488058665817,,,-0.0455788503034761,-0.0816849229958007,0.0361060726923245,0.5791855333793916,0.078554823728743,0.5006307096506486,ok,sec_companyfacts_dei,https://www.sec.gov/Archives/edgar/data/1710072/000155837022012067,2022-07-31,2022-08-04,0.82,reviewed,rule_reviewed_timestamp_repaired_clean_slice,has_evidence,agent_2l,2026-05-23,, Agent 2L clean-slice expansion candidate; parser-derived and retained only for timestamp/context/dedupe validation.,,,,,,data\events\capital_raise_clean_slice_2l_enriched_candidates.csv,2022-09-14T21:03:27,2022-09-14T21:03:27+00:00,,2022-09-14T21:03:27+00:00,sec_acceptance,sec_acceptance,unknown,after_close,after_close,0.95,ok,,ok,primary,cr2l_0057,,True
EWTX_8-K_2024-01-19_0001104659-24-005031,EWTX,2024-01-19T13:44:25+00:00,financing,EWTX registered direct offering candidate from source document.,registered_direct_offering,capital_raise_dilution,sec_primary_filing,https://www.sec.gov/Archives/edgar/data/1710072/000110465924005031/tm243583d4_8k.htm,before_open,unknown,negative,medium,0.5,,"Capital-raise parser candidate; review transaction-vs-capacity classification, offering size, price, source timing, and market-cap context before modeling.",EWTX_8-K_2024-01-19_0001104659-24-005031_tm243583d4_8k;EWTX_8-K_2024-01-19_0001104659-24-005031_tm243583d4_ex1-1;EWTX_8-K_2024-01-19_0001104659-24-005031_tm243583d4_ex5-1;EWTX_8-K_2024-01-19_0001104659-24-005031_tm243583d4_ex99-1,17,11.0,0.86,"stock, par value $0.0001 per share (the “Common Stock”), at an offering price of $11.00 per share",240000000.0,0.88,"gross proceeds from the offering to be approximately $240 million, before deducting underwriting discounts and commissions and offering",registered_direct_offering,0.86,registered direct offering language,common_stock,0.86,common stock/share language,240000000.0,0.84,"gross proceeds from the offering to be approximately $240 million, before deducting underwriting discounts and commissions and offering",21818182.0,0.84,"pricing of an underwritten offering of 21,818,182 shares of its common stock at an offering price of $11.00 per share",240000000.0,gross_proceeds,0.88,11.0,True,False,True,False,False,"and the Company will not directly or indirectly use the proceeds of the offering of the Shares hereunder, or lend, contribute or otherwise",0.7,"and the Company will not directly or indirectly use the proceeds of the offering of the Shares hereunder, or lend, contribute or otherwise",,,,,,,,,,,,,,,,,,,2024-01-19,13.039999961853027,-0.1564417153236813,63461608.0,827539365.8991318,0.3438012790347197,0.2900164147952491,,,0.4235808055757881,0.01598432948238,0.4075964760934081,0.937592856596787,0.1520380150824192,0.7855548415143678,ok,sec_companyfacts_dei,https://www.sec.gov/Archives/edgar/data/1710072/000155837023018427,2023-10-31,2023-11-09,0.82,reviewed,rule_reviewed_timestamp_repaired_clean_slice,has_evidence,agent_2l,2026-05-23,, Agent 2L clean-slice expansion candidate; parser-derived and retained only for timestamp/context/dedupe validation.,,,,,,data\events\capital_raise_clean_slice_2l_enriched_candidates.csv,2024-01-19T13:44:25,2024-01-19T13:44:25+00:00,,2024-01-19T13:44:25+00:00,sec_acceptance,sec_acceptance,unknown,before_open,before_open,0.95,ok,,ok,primary,cr2l_0058,,True
EWTX_8-K_2025-04-02_0001104659-25-030870,EWTX,2025-04-02T10:29:14+00:00,financing,EWTX registered direct offering candidate from source document.,registered_direct_offering,capital_raise_dilution,sec_primary_filing,https://www.sec.gov/Archives/edgar/data/1710072/000110465925030870/tm2510984d1_8k.htm,before_open,unknown,negative,low,0.5,,"Capital-raise parser candidate; review transaction-vs-capacity classification, offering size, price, source timing, and market-cap context before modeling.",EWTX_8-K_2025-04-02_0001104659-25-030870_tm2510984d1_8k;EWTX_8-K_2025-04-02_0001104659-25-030870_tm2510984d1_ex1-1;EWTX_8-K_2025-04-02_0001104659-25-030870_tm2510984d1_ex5-1;EWTX_8-K_2025-04-02_0001104659-25-030870_tm2510984d1_ex99-1,14,20.13,0.86,offering price of $20.13 per share,,,,registered_direct_offering,0.86,registered direct offering language,common_stock,0.86,common stock/share language,,,,20.13,0.84,"an underwritten offering of $20.13 shares of its common stock at an offering price of $9,935,419 per share",405.2169,shares_offered_x_price_per_share,0.78,20.13,True,False,True,False,False,"and the Company will not directly or indirectly use the proceeds of the offering of the Shares hereunder, or lend, contribute or otherwise",0.7,"and the Company will not directly or indirectly use the proceeds of the offering of the Shares hereunder, or lend, contribute or otherwise",,,,,,,,,,,,,,,,,,,2025-04-02,15.520000457763672,0.2970360442180423,95205283.0,1477586035.74152,2.1143784636405107e-07,2.7424250784601094e-07,,,-0.4189441785946775,-0.0288851381668371,-0.3900590404278403,-0.4401154097328315,-0.0434694877483202,-0.3966459219845112,ok,sec_companyfacts_dei,https://www.sec.gov/Archives/edgar/data/1710072/000155837025002006,2025-02-24,2025-03-03,0.82,reviewed,rule_reviewed_timestamp_repaired_clean_slice,has_evidence,agent_2l,2026-05-23,, Agent 2L clean-slice expansion candidate; parser-derived and retained only for timestamp/context/dedupe validation.,,,,,,data\events\capital_raise_clean_slice_2l_enriched_candidates.csv,2025-04-02T10:29:14,2025-04-02T10:29:14+00:00,,2025-04-02T10:29:14+00:00,sec_acceptance,sec_acceptance,unknown,before_open,before_open,0.95,ok,,ok,primary,cr2l_0059,,True
FATE_8-K_2020-06-10_0001193125-20-164916,FATE,2020-06-10T01:21:17+00:00,financing,FATE completed equity offering candidate from source document.,completed_equity_offering,capital_raise_dilution,sec_primary_filing,https://www.sec.gov/Archives/edgar/data/1434316/000119312520164916/d941680d8k.htm,after_close,unknown,negative,medium,0.5,,"Capital-raise parser candidate; review transaction-vs-capacity classification, offering size, price, source timing, and market-cap context before modeling.",FATE_8-K_2020-06-10_0001193125-20-164916_d941680d8k;FATE_8-K_2020-06-10_0001193125-20-164916_d941680dex11;FATE_8-K_2020-06-10_0001193125-20-164916_d941680dex51;FATE_8-K_2020-06-10_0001193125-20-164916_d941680dex991;FATE_8-K_2020-06-10_0001193125-20-164916_d941680dex992,23,28.31,0.86,"common stock at a public offering price of $28.31 per share, before underwriting discounts, for an aggregate offering of approximately $175 million",,,,completed_equity_offering,0.87,public common-stock offering transaction language,common_stock,0.86,common stock/share language,50000000.0,0.8,"Under the Stock Purchase Agreement, the Company has agreed to sell 1,766,160 shares of common stock (the “Shares”) to JJDC at $28.31 per share, for an aggregate purchase price of approximately $50.0 million, subject to customary closing conditions and subject to the completion of the offering and the expiration or early termination of applicable waiting periods relating to certain antitrust filings under the Hart-Scott-Rodino Antitrust Improvements Act of 1976, as amended (the “JJDC Private Placement”)",6181562.0,0.84,"(the “Company”) entered into an underwriting agreement (the “Underwriting Agreement”) with Jefferies LLC and SVB Leerink LLC, as representatives of the several underwriters named therein (the “Underwriters”), relating to the underwritten public offering of 6,181,562 shares of the Company’s common stock, par value $0.001 per share (the “Offering”)",50000000.0,offering_amount,0.8,28.31,True,False,True,False,False,"This report contains “forward-looking statements” within the meaning of Section 27A of the Securities Act and Section 21E of the Securities Exchange Act of 1934, as amended (the “Exchange Act”), including statements regarding the Company’s expectations with respect to the Offering and JJDC Private Placement, including its ability to complete the Offering and its expected and intended use of proceeds from the Offering, and its ability to complete the purchase and sale of shares of the Company’s C",0.7,"This report contains “forward-looking statements” within the meaning of Section 27A of the Securities Act and Section 21E of the Securities Exchange Act of 1934, as amended (the “Exchange Act”), including statements regarding the Company’s expectations with respect to the Offering and JJDC Private Placement, including its ability to complete the Offering and its expected and intended use of proceeds from the Offering, and its ability to complete the purchase and sale of shares of the Company’s Common Stock under the Stock Purchase Agreement",164200000.0,0.82,"The net proceeds to the Company from the Offering are expected to be approximately $164.2 million, after deducting underwriting discounts and commissions and other estimated offering expenses payable by the Company",,,,,,,,,,,,,,,,2020-06-10,32.9900016784668,-0.1418612137119569,77691848.0,2563054195.923188,0.0795651301794237,0.0195079761011415,,,0.1474783192510189,0.1127777030816608,0.0347006161693581,0.9091435397894654,0.3378181963232216,0.5713253434662438,ok,sec_companyfacts_dei,https://www.sec.gov/Archives/edgar/data/1434316/000156459020024213,2020-05-07,2020-05-11,0.82,reviewed,rule_reviewed_timestamp_repaired_clean_slice,has_evidence,agent_2l,2026-05-23,,Rule-reviewed completed financing candidate; requires human spot-check before modeling.,agent_2c_base,,,,completed_common_stock,data\events\capital_raise_enriched.csv,2020-06-10T01:21:17,2020-06-10T01:21:17+00:00,,2020-06-10T01:21:17+00:00,sec_acceptance,sec_acceptance,unknown,after_close,after_close,0.95,ok,,ok,primary,cr2l_0060,,True
FATE_424B5_2021-01-07_0001193125-21-004330,FATE,2021-01-07T22:25:25+00:00,financing,FATE completed equity offering candidate from source document.,completed_equity_offering,capital_raise_dilution,sec_primary_filing,https://www.sec.gov/Archives/edgar/data/1434316/000119312521004330/d82270d424b5.htm,after_close,unknown,negative,medium,0.5,,"Capital-raise parser candidate; review transaction-vs-capacity classification, offering size, price, source timing, and market-cap context before modeling.",FATE_424B5_2021-01-07_0001193125-21-004330_d82270d424b5,8,85.5,0.86,"Redmile Group, LLC (collectively, Redmile), which are existing stockholders, have agreed to purchase (i) 327,485 shares of our common stock at the public offering price of $85.50 per share and (ii) pre-funded warrants to purchase 257,310 shares of",,,,completed_equity_offering,0.87,public common-stock offering transaction language,common_stock,0.86,common stock/share language,52500000.0,0.8,"option, exercisable for 30 days from the date of this prospectus supplement, to purchase, from time to time, in whole or in part, up to an aggregate of $52,500,000 of shares from us at the public offering price set forth on the cover page of this",327485.0,0.84,"Redmile Group, LLC (collectively, Redmile), which are existing stockholders, have agreed to purchase (i) 327,485 shares of our common stock at the public offering price of $85.50 per share and (ii) pre-funded warrants to purchase 257,310 shares of",52500000.0,offering_amount,0.8,85.5,True,False,True,False,True,USE OF PROCEEDS,0.7,USE OF PROCEEDS,375700000.0,0.82,"We expect to receive net proceeds from this offering, including proceeds from the sale of pre-funded warrants, of approximately $375.7 million, or $432.1 million if the underwriters exercise their option to purchase additional shares",,,,True,0.74,liquidity / cash runway language,,,,,,,,,,2021-01-07,117.22000122070312,-0.2706022938950525,87244032.0,10226745537.539062,0.0037536664972109,0.0051335979571692,,,0.2796943577877919,0.0284896481685557,0.2512047096192362,1.4045128455528846,0.0802600495890357,1.3242527959638488,ok,sec_companyfacts_dei,https://www.sec.gov/Archives/edgar/data/1434316/000156459020051301,2020-11-03,2020-11-05,0.82,reviewed,rule_reviewed_timestamp_repaired_clean_slice,has_evidence,agent_2l,2026-05-23,,Rule-reviewed completed financing candidate; requires human spot-check before modeling.,agent_2c_base,,,,completed_common_stock,data\events\capital_raise_enriched.csv,2021-01-07T22:25:25,2021-01-07T22:25:25+00:00,,2021-01-07T22:25:25+00:00,sec_acceptance,sec_acceptance,unknown,after_close,after_close,0.95,ok,,ok,primary,cr2l_0061,Primary among 2 same-financing candidate documents.,True
FCEL_424B5_2020-06-16_0001104659-20-073835,FCEL,2020-06-16T21:21:18+00:00,financing,FCEL completed equity offering candidate from source document.,completed_equity_offering,capital_raise_dilution,sec_primary_filing,https://www.sec.gov/Archives/edgar/data/886128/000110465920073835/tm2022598-1_424b5.htm,after_close,unknown,negative,medium,0.5,,"Capital-raise parser candidate; review transaction-vs-capacity classification, offering size, price, source timing, and market-cap context before modeling.",FCEL_424B5_2020-06-16_0001104659-20-073835_tm2022598-1_424b5,9,2.73,0.86,"For purposes of calculating dilution, we have assumed a sale price of $2.73 per share, which was the closing price of our stock on The Nasdaq Global Market on June 12, 2020. However, since the shares may be sold at a variety of prices, these dilution numbers are merely an example of potential dilution based on an assumed sales price",75000000.0,0.88,"Assuming that an aggregate of 27,472,527 shares of our common stock are sold at a price of $2.73 per share, the last reported sale price of our common stock on The Nasdaq Global Market on June 12, 2020, for aggregate gross proceeds of approximately $75,000,000, and after deducting commissions and estimated aggregate offering expenses payable by us, you will experience immediate dilution of $2.07 per share, representing the difference between our as adjusted net tangible book value per share as of April 30, 2020 after giving effect to this offering and the assumed offering price",completed_equity_offering,0.87,public common-stock offering transaction language,common_stock,0.86,common stock/share language,75000000.0,0.84,"Assuming that an aggregate of 27,472,527 shares of our common stock are sold at a price of $2.73 per share, the last reported sale price of our common stock on The Nasdaq Global Market on June 12, 2020, for aggregate gross proceeds of approximately $75,000,000, and after deducting commissions and estimated aggregate offering expenses payable by us, you will experience immediate dilution of $2.07 per share, representing the difference between our as adjusted net tangible book value per share as of April 30, 2020 after giving effect to this offering and the assumed offering price",8000000.0,0.84,"8,000,000 shares of common stock reserved for issuance upon exercise of our outstanding warrants issued pursuant to our senior secured credit facility with Orion Energy Partners Investment Agent, LLC, as administrative agent and collateral agent, and certain of its affiliated lenders",75000000.0,gross_proceeds,0.88,2.73,True,False,True,False,True,Use of Proceeds,0.7,Use of Proceeds,,,,,,,True,0.74,liquidity / cash runway language,,,,1.0,0.78,"Each share of Series B Preferred Stock may be converted at any time, at the option of the holder, into 0.591 shares of our common stock (which is equivalent to an initial conversion price of $1,692.00 per share) plus cash in lieu of fractional shares",,,,2020-06-16,77.69999694824219,-0.9648648634848916,211058085.0,16399212560.40184,0.0379042574938553,0.0045733903212583,,,0.3560209072042588,0.0608816077422418,0.295139299462017,1.122950824798035,0.3678323630562841,0.755118461741751,ok,sec_companyfacts_dei,https://www.sec.gov/Archives/edgar/data/886128/000156459020029076,2020-06-05,2020-06-12,0.82,reviewed,rule_reviewed_timestamp_repaired_clean_slice,has_evidence,agent_2l,2026-05-23,,Rule-reviewed completed financing candidate; requires human spot-check before modeling.,agent_2c_base,,,,completed_common_stock,data\events\capital_raise_enriched.csv,2020-06-16T21:21:18,2020-06-16T21:21:18+00:00,,2020-06-16T21:21:18+00:00,sec_acceptance,sec_acceptance,unknown,after_close,after_close,0.95,ok,,ok,primary,cr2l_0062,,True
