BBIO_8-K_2021-12-27_0001193125-21-366669__placebo01,BBIO,2022-01-26 12:06:03,placebo,Placebo non-event control for BBIO_8-K_2021-12-27_0001193125-21-366669,non_event_control,placebo_control,placebo,,unknown,unknown,unknown,unknown,0.0,XBI,"Biotech catalyst parser candidate; review source facts, exact timestamp/session, expectation context, pipeline concentration, and materiality before modeling.",negative,high,rule_reviewed_fresh_confirmation,source_backed,reviewed,,agent_3e_rule_review=fresh_readout_with_new_result_language,BBIO_8-K_2021-12-27_0001193125-21-366669_d285149d8k;BBIO_8-K_2021-12-27_0001193125-21-366669_d285149dex991,13,BridgeBio Pharma Reports Month 12 Topline Results from Phase 3 ATTRibute-CM Study,phase_3_readout,EX-99,symptomatic transthyretin (TTR) amyloid cardiomyopathy (ATTR-CM),phase_3,,,at Month 12,False,0.05,,,,,,,,,,,,,,,,,True,True,False,False,False,False,True,False,True,boilerplate_or_risk_factor_not_event;endpoint_direction_unclear;pipeline_table_requires_new_result;requires_pipeline_concentration_review,,,,,0.78,"(Nasdaq: BBIO) today announced topline results from Month 12 (Part A) of ATTRibute-CM, an ongoing global Phase 3 study investigating acoramidis for the treatment of symptomatic transthyretin (TTR) amyloid cardiomyopathy (ATTR-CM)",0.86,"EX-99.1 2 d285149dex991.htm EX-99.1 EX-99.1 Exhibit 99.1 BridgeBio Pharma Reports Month 12 Topline Results from Phase 3 ATTRibute-CM Study • ATTRibute-CM did not meet its primary endpoint at Month 12. Mean observed six-minute walk distance (6MWD) decline for the acoramidis and placebo arms were 9 meters and 7 meters, respectively",0.75,BridgeBio Pharma Reports Month 12 Topline Results from Phase 3 ATTRibute-CM Study,,,0.92,BridgeBio Pharma Reports Month 12 Topline Results from Phase 3 ATTRibute-CM Study,0.92,BridgeBio Pharma Reports Month 12 Topline Results from Phase 3 ATTRibute-CM Study,,,,,,,,,0.92,issued a press release announcing Month 12 Topline Results from its Phase 3 ATTRibute-CM Study,,,0.92,"EX-99.1 2 d285149dex991.htm EX-99.1 EX-99.1 Exhibit 99.1 BridgeBio Pharma Reports Month 12 Topline Results from Phase 3 ATTRibute-CM Study • ATTRibute-CM did not meet its primary endpoint at Month 12. Mean observed six-minute walk distance (6MWD) decline for the acoramidis and placebo arms were 9 meters and 7 meters, respectively",0.88,"Both declines are similar to healthy elderly adults and less than prior untreated ATTR-CM cohorts • The company observed improvements at Month 12 on the Kansas City Cardiomyopathy Questionnaire Overall Score (KCCQ-OS, nominal p < 0.05), a quality-of-life measurement, N-terminal pro BNP (NT-proBNP, median +0.6% vs",,,0.76,"EX-99.1 2 d285149dex991.htm EX-99.1 EX-99.1 Exhibit 99.1 BridgeBio Pharma Reports Month 12 Topline Results from Phase 3 ATTRibute-CM Study • ATTRibute-CM did not meet its primary endpoint at Month 12. Mean observed six-minute walk distance (6MWD) decline for the acoramidis and placebo arms were 9 meters and 7 meters, respectively",,,,,,,,,,,,,,,,,,,True,fresh_readout_with_new_result_language,2021-12-27,11.380000114440918,147166573.0,2021-11-04 00:00:00,https://www.sec.gov/Archives/edgar/data/1743881/000095017021003080,1674755617.5818777,-0.7122629498364889,-0.0137866942548116,-0.6984762555816773,-0.7572007601071371,-0.0838438396002031,-0.673356920506934,,false,none,small_300m_2b,True,False,False,True,BBIO_8-K_2021-12-27_0001193125-21-366669,ok,,2022-01-26,SPY,-0.012328067881907488,-1.5157134282216573,0.12239061713994893,120,-0.13742625634880473,-0.10457973317008758,0.06718751998925067,-0.09393468986224969,0.00858039004152841,-0.04975611989091078,-0.002508618139414165,-0.008484744019953583,-0.04251566705604474,-0.04162454951856809,-0.04852484143493312,-0.04736632577553457,-0.01958855695271766,-0.0312536558476943,-0.03077030888626442,-0.3473768500360589,0.7283082227701714,False,down,False,-0.11804878420946063,0.017216547036162044,-0.06092268419757596,-0.06276107068436772,-0.06083215838631084,-0.1426885570732874,-0.13297594464004914,-0.030641288595606442,-0.09449798701421633,-0.09017043390183122,-0.2960612659777291,0.7671832938876617,False,down,False,-0.044878052502143495,0.037908421104439816,-0.16445967607835554,0.13376041595120103,0.14311891377659736,-0.08312380749374984,-0.0797627920953663,0.01707173455850497,-0.06284390297319391,-0.06090994858640908,0.3456045774274046,0.7296399054395715,False,up,True,False,down,False,down,False,down
TARS_8-K_2022-05-02_0001193125-22-135307__placebo01,TARS,2022-06-01 11:06:00,placebo,Placebo non-event control for TARS_8-K_2022-05-02_0001193125-22-135307,non_event_control,placebo_control,placebo,,unknown,unknown,unknown,unknown,0.0,XBI,"Biotech catalyst parser candidate; review source facts, exact timestamp/session, expectation context, pipeline concentration, and materiality before modeling.",positive,high,rule_reviewed_fresh_confirmation,source_backed,reviewed,,agent_3e_rule_review=fresh_readout_with_new_result_language,TARS_8-K_2022-05-02_0001193125-22-135307_d232851d8k;TARS_8-K_2022-05-02_0001193125-22-135307_d232851dex991,12,(the “Company”) announced positive results of the Company’s Saturn-2 trial,phase_3_readout,Saturn-2,Demodex blepharitis,phase_3,,Saturn-2,"complete collarette cure Very high responder rate to TP-03 96% of patients improved at least one collarette grade, 89% achieved a clinically meaningful cure Strong consistency across all endpoints compared with Saturn-1 ",True,,,,,,,,,,,,,,,,,,True,True,False,False,False,False,False,True,True,endpoint_direction_unclear;pipeline_table_requires_new_result;requires_pipeline_concentration_review,,,,,0.78,"Saturn-2 is a Phase 3 randomized, controlled, double-masked trial evaluating the efficacy and safety of TP-03 in patients with Demodex blepharitis",0.86,(the “Company”) announced positive results of the Company’s Saturn-2 trial,0.75,(the “Company”) announced positive results of the Company’s Saturn-2 trial,,,0.92,(the “Company”) announced positive results of the Company’s Saturn-2 trial,0.92,(the “Company”) announced positive results of the Company’s Saturn-2 trial,,,,,,,,,0.92,"Saturn-2 is a Phase 3 randomized, controlled, double-masked trial evaluating the efficacy and safety of TP-03 in patients with Demodex blepharitis",,,0.92,"Erythema Cure Post Treatment (Day 43) Erythema Grade 0 Collarette Cure Baseline (Day 0) Collarette Grade 4 Post Treatment (Day 43) Collarette Grade 0 Post Treatment (Day 43) Collarette Grade 0 Baseline (Day 0) Collarette Grade 4 Baseline (Day 0) Erythema Grade 1 56% of patients met primary endpoint of complete collarette cure Very high responder rate to TP-03 96% of patients improved at least one collarette grade, 89% achieved a clinically meaningful cure Strong consistency across all endpoints compared with Saturn-1 All primary and secondary endpoints met with high statistical significance Clinically and statistically significant effects seen within 2 weeks TP-03 was generally safe and well tolerated, similar to Saturn-1 Saturn-2 Results Position TP-03 for Potential FDA Approval and Ultimate Commercial Success © Tarsus Ph",,,,,0.76,"Erythema Cure Post Treatment (Day 43) Erythema Grade 0 Collarette Cure Baseline (Day 0) Collarette Grade 4 Post Treatment (Day 43) Collarette Grade 0 Post Treatment (Day 43) Collarette Grade 0 Baseline (Day 0) Collarette Grade 4 Baseline (Day 0) Erythema Grade 1 56% of patients met primary endpoint of complete collarette cure Very high responder rate to TP-03 96% of patients improved at least one collarette grade, 89% achieved a clinically meaningful cure Strong consistency across all endpoints compared with Saturn-1 All primary and secondary endpoints met with high statistical significance Clinically and statistically significant effects seen within 2 weeks TP-03 was generally safe and well tolerated, similar to Saturn-1 Saturn-2 Results Position TP-03 for Potential FDA Approval and Ultimate Commercial Success © Tarsus Ph",,,0.7,(the “Company”) announced positive results of the Company’s Saturn-2 trial,,,,,,,,,,,,,,,True,fresh_readout_with_new_result_language,2022-05-02,14.0,20708946.0,2022-03-14 00:00:00,https://www.sec.gov/Archives/edgar/data/1819790/000181979022000010,289925244.0,-0.1860465477323954,-0.1767102697816801,-0.0093362779507153,-0.1735537450631592,-0.1415474602189458,-0.0320062848442134,,true,none,micro_lt_300m,True,False,False,True,TARS_8-K_2022-05-02_0001193125-22-135307,ok,,2022-06-01,SPY,-0.004229624695164823,1.0291933636990944,0.04842307469736372,120,-0.01730394820442071,-0.018018505502678105,0.04626389120462136,-0.00374674300041645,0.020259819805784552,-0.007272755015980237,-0.008088535351464476,-0.012509242195699155,0.005288811008063462,0.005302821457653151,0.0008220945983463089,0.0008224326107302282,-0.018173713733340757,0.011041553743296162,0.011102736675355107,0.1092208836617184,0.9130272966310089,False,up,True,0.007272755015980348,-0.005787678387682016,-0.01848974657604141,0.025909254696214364,0.02624781707796764,0.013050927967484482,0.01313646302681315,0.035330143792523305,-0.027473919300161236,-0.02709994386309067,0.30891708688164593,0.7573845986518895,False,up,True,-0.08000002774325299,-0.09459216607407495,-0.13460305121896932,0.061185337893157526,0.06309592788907836,0.01598815247549557,0.01611664686790837,-0.07792959464669236,-0.0022479423083865057,-0.002245417578245812,0.39957195687930924,0.6894718147614054,False,up,True,True,up,False,down,False,down
KRYS_8-K_2022-05-20_0001711279-22-000020__placebo01,KRYS,2022-06-21 12:26:23,placebo,Placebo non-event control for KRYS_8-K_2022-05-20_0001711279-22-000020,non_event_control,placebo_control,placebo,,unknown,unknown,unknown,unknown,0.0,XBI,"Biotech catalyst parser candidate; review source facts, exact timestamp/session, expectation context, pipeline concentration, and materiality before modeling.",positive,high,rule_reviewed_fresh_confirmation,source_backed,reviewed,,agent_3e_rule_review=fresh_readout_with_new_result_language,KRYS_8-K_2022-05-20_0001711279-22-000020_krys-20220520;KRYS_8-K_2022-05-20_0001711279-22-000020_sid2022_gem3safetyeposte;KRYS_8-K_2022-05-20_0001711279-22-000020_sid2022_gem3safetyposter,17,"Conclusions  B-VEC treatment demonstrated a durable and statistically significant improvement in complete wound healing at 3 and 6 months compared with placebo  B-VEC was generally well tolerated, with no treatment-related discontinuations  No clinically significant immunologic reactions were reported during the study  Treatment response to B-VEC was not associated with anti-HSV-1 serostatus at baseline or with anti-COL7 seroconversion  An ongoing open-label extension study is investigating the long-term efficacy and safety of B-VEC in patients with DEB, regardless of prior enrollment in GEM-3 7 Open-label extension study: NCT04917874 B-VEC, beremagene geperpavec",phase_3_readout,B-VEC,DEB 3 6 Months (Week 26) B-VEC was Generally Well Tolerated Total patients (n=31) Total number of AEs 45 Patients with ≥1 AE,phase_3,NCT04491604,,complete wound healing at 6 months,True,0.005,,,,,,,,,,,,,,,,,True,True,False,False,False,False,False,True,True,pipeline_table_requires_new_result;requires_pipeline_concentration_review,,,,,0.78,"treatment resumed if wound reopened Open-Label B-VEC Remaining weekly dose† used to treat secondary wounds GEM-3: Phase 3 Study Evaluating the Efficacy and Safety of B-VEC in Patients with DEB 3 6 Months (Week 26) B-VEC was Generally Well Tolerated Total patients (n=31) Total number of AEs 45 Patients with ≥1 AE, n (%) 18 (58.1) Mild AE 15 (48.4) Moderate AE 3 (9.7) Severe AE 2 (6.5) Serious AE 3 (9.7) Drug-related AE 1 (3.2) AE leading to treatment discontinuation 0 (0) Death 0 (0) *AEs were coded using MedDRA version 24.1. At each level of summarization, a patient was counted once if the patient reported ≥1 event",0.86,", Pittsburgh, PA Efficacy • The proportion of primary wounds with complete wound healing was significantly greater with B-VEC than placebo at both the 3- and 6-month timepoints (P<0.005; Figure 3) – In the patient with DDEB, the primary endpoint of complete wound healing at 6 months was achieved by the B-VEC–treated wound, but not by the placebo-treated wound • Pain and health-related quality of life assessments demonstrated improvement consistent with a wound healing response Table 1. Baseline demographics and clinical characteristics *In a small number of patients, the predefined threshold values for wound area by size category fell in between the size of the 2 wounds",0.75,", Pittsburgh, PA Efficacy • The proportion of primary wounds with complete wound healing was significantly greater with B-VEC than placebo at both the 3- and 6-month timepoints (P<0.005; Figure 3) – In the patient with DDEB, the primary endpoint of complete wound healing at 6 months was achieved by the B-VEC–treated wound, but not by the placebo-treated wound • Pain and health-related quality of life assessments demonstrated improvement consistent with a wound healing response Table 1. Baseline demographics and clinical characteristics *In a small number of patients, the predefined threshold values for wound area by size category fell in between the size of the 2 wounds",,,0.92,"Conclusions  B-VEC treatment demonstrated a durable and statistically significant improvement in complete wound healing at 3 and 6 months compared with placebo  B-VEC was generally well tolerated, with no treatment-related discontinuations  No clinically significant immunologic reactions were reported during the study  Treatment response to B-VEC was not associated with anti-HSV-1 serostatus at baseline or with anti-COL7 seroconversion  An ongoing open-label extension study is investigating the long-term efficacy and safety of B-VEC in patients with DEB, regardless of prior enrollment in GEM-3 7 Open-label extension study: NCT04917874 B-VEC, beremagene geperpavec",0.92,"Conclusions  B-VEC treatment demonstrated a durable and statistically significant improvement in complete wound healing at 3 and 6 months compared with placebo  B-VEC was generally well tolerated, with no treatment-related discontinuations  No clinically significant immunologic reactions were reported during the study  Treatment response to B-VEC was not associated with anti-HSV-1 serostatus at baseline or with anti-COL7 seroconversion  An ongoing open-label extension study is investigating the long-term efficacy and safety of B-VEC in patients with DEB, regardless of prior enrollment in GEM-3 7 Open-label extension study: NCT04917874 B-VEC, beremagene geperpavec",,,,,,,,,0.92,"htm EX-99.2 sid2022_gem3safetyeposte GEM-3: Phase 3 Safety and Immunogenicity Results of Beremagene Geperpavec (B-VEC), an Investigational, Topical Gene Therapy for Dystrophic Epidermolysis Bullosa (DEB) 1Stanford University, Redwood City, CA, USA",,,0.92,", Pittsburgh, PA Efficacy • The proportion of primary wounds with complete wound healing was significantly greater with B-VEC than placebo at both the 3- and 6-month timepoints (P<0.005; Figure 3) – In the patient with DDEB, the primary endpoint of complete wound healing at 6 months was achieved by the B-VEC–treated wound, but not by the placebo-treated wound • Pain and health-related quality of life assessments demonstrated improvement consistent with a wound healing response Table 1. Baseline demographics and clinical characteristics *In a small number of patients, the predefined threshold values for wound area by size category fell in between the size of the 2 wounds",0.88,", Pittsburgh, PA Efficacy • The proportion of primary wounds with complete wound healing was significantly greater with B-VEC than placebo at both the 3- and 6-month timepoints (P<0.005; Figure 3) – In the patient with DDEB, the primary endpoint of complete wound healing at 6 months was achieved by the B-VEC–treated wound, but not by the placebo-treated wound • Pain and health-related quality of life assessments demonstrated improvement consistent with a wound healing response Table 1. Baseline demographics and clinical characteristics *In a small number of patients, the predefined threshold values for wound area by size category fell in between the size of the 2 wounds",0.95,NCT04491604,0.76,a responder was defined as meeting the primary endpoint of complete wound healing at 6 months,,,,,,,,,,,,,,,,,,,True,fresh_readout_with_new_result_language,2022-05-20,59.040000915527344,25635138.0,2022-05-09 00:00:00,https://www.sec.gov/Archives/edgar/data/1711279/000171127922000016,1513498570.9896698,-0.1481748233273891,-0.1191131236551821,-0.029061699672207,-0.0286278035326684,-0.209775276541284,0.1811474730086155,,true,none,small_300m_2b,True,False,False,True,KRYS_8-K_2022-05-20_0001711279-22-000020,ok,,2022-06-21,SPY,0.00046613054931551455,1.9056827714724593,0.03444535974023391,120,-0.0068235327508179705,-0.025439427571146297,0.05041255356353012,-0.058200325873707756,0.018535436136739532,0.10018020492416246,0.025174039295016604,0.04900905751599094,0.04762802523933296,0.048780462896423904,0.07061159643409742,0.07316432406025952,0.035793595131285105,0.06030609755608705,0.062161621867063754,1.3827123768924101,0.16675307533373473,False,up,True,0.22432426933769722,0.03334639937283024,0.06599590944044098,0.13847958649455558,0.1485262358843058,0.16958660763554706,0.18481495661162328,0.12749609109191007,0.08238974942505076,0.08587894806093299,2.3211029625715502,0.020281287540547144,True,up,True,0.28558555809227215,0.04400616356621789,0.09060248649607106,0.16448401834335596,0.17878473046824817,0.20814890854254853,0.2313965213584983,0.19789966103510115,0.07064456099545877,0.07319970103456086,1.510055753763448,0.13102919831738102,False,up,True,True,up,True,up,True,up
KRYS_8-K_2022-08-18_0001711279-22-000052__placebo01,KRYS,2022-09-19 21:02:42,placebo,Placebo non-event control for KRYS_8-K_2022-08-18_0001711279-22-000052,non_event_control,placebo_control,placebo,,unknown,unknown,unknown,unknown,0.0,XBI,"Biotech catalyst parser candidate; review source facts, exact timestamp/session, expectation context, pipeline concentration, and materiality before modeling.",positive,low,rule_reviewed_fresh_confirmation,source_backed,reviewed,,agent_3e_rule_review=fresh_designation_only_contrast,KRYS_8-K_2022-08-18_0001711279-22-000052_fdaacceptskrystalbiotech;KRYS_8-K_2022-08-18_0001711279-22-000052_krys-20220818,15,"FDA Accepts Krystal Biotech’s Biologics License Application for Dystrophic Epidermolysis Bullosa • FDA granted Priority Review designation • PDUFA target action date is February 17, 2023 • FDA stated that it is not currently planning to hold an advisory committee meeting August 18, 2022 PITTSBURGH, August 18, 2022 (GLOBE NEWSWIRE) – Krystal Biotech, Inc",priority_review,B-VEC,patients with dystrophic epidermolysis bullosa (DEB),pivotal,NCT04491604,GEM-3,,,,,,,,,,priority_review,,,,,,,,,,False,False,True,True,False,False,False,False,True,boilerplate_or_risk_factor_not_event;designation_only_weaker_signal;requires_pipeline_concentration_review,,,,,0.78,"(the “Company”) (NASDAQ: KRYS), the leader in redosable gene therapy, today announced that the US Food and Drug Administration (FDA) has accepted for filing the Company’s Biologics License Application (BLA) for B-VEC for the treatment of patients with dystrophic epidermolysis bullosa (DEB)",0.86,"On August 18, 2022, the FDA accepted the Company’s BLA for B-VEC for the treatment of patients with dystrophic epidermolysis bullosa",0.75,"FDA Accepts Krystal Biotech’s Biologics License Application for Dystrophic Epidermolysis Bullosa • FDA granted Priority Review designation • PDUFA target action date is February 17, 2023 • FDA stated that it is not currently planning to hold an advisory committee meeting August 18, 2022 PITTSBURGH, August 18, 2022 (GLOBE NEWSWIRE) – Krystal Biotech, Inc",,,0.86,"FDA Accepts Krystal Biotech’s Biologics License Application for Dystrophic Epidermolysis Bullosa • FDA granted Priority Review designation • PDUFA target action date is February 17, 2023 • FDA stated that it is not currently planning to hold an advisory committee meeting August 18, 2022 PITTSBURGH, August 18, 2022 (GLOBE NEWSWIRE) – Krystal Biotech, Inc",0.86,"FDA Accepts Krystal Biotech’s Biologics License Application for Dystrophic Epidermolysis Bullosa • FDA granted Priority Review designation • PDUFA target action date is February 17, 2023 • FDA stated that it is not currently planning to hold an advisory committee meeting August 18, 2022 PITTSBURGH, August 18, 2022 (GLOBE NEWSWIRE) – Krystal Biotech, Inc",0.86,"The application has been granted Priority Review designation and the FDA has set a Prescription Drug User Fee Act action date of February 17, 2023. The FDA stated in its BLA filing communication letter that it is not currently planning to hold an advisory committee meeting to discuss the application",,,,,,,0.78,"(NASDAQ: KRYS) is a pivotal-stage gene therapy company leveraging its proprietary, redosable gene therapy platform and in-house manufacturing capabilities to develop life-changing medicines for patients with serious diseases, including rare diseases in skin, lung, and other areas",,,,,,,0.95,” The BLA submission for B-VEC is supported by data from two placebo controlled clinical trials - the GEM-3 trial (NCT04491604) and the GEM-1/2 trial (NCT03536143),,,,,0.7,” The BLA submission for B-VEC is supported by data from two placebo controlled clinical trials - the GEM-3 trial (NCT04491604) and the GEM-1/2 trial (NCT03536143),,,,,,,,,,,,,,,True,fresh_designation_only_contrast,2022-08-18,74.41000366210938,25664287.0,2022-08-08 00:00:00,https://www.sec.gov/Archives/edgar/data/1711279/000171127922000047,1909679689.655426,0.0443509285910088,0.0554630520520322,-0.0111121234610234,0.2884849118979977,0.2670372061360462,0.0214477057619515,,unknown,none,small_300m_2b,False,True,True,False,KRYS_8-K_2022-08-18_0001711279-22-000052,ok,,2022-09-19,SPY,0.0011731876875585039,1.6674141256341377,0.036455168774006154,120,-0.03329813675523703,-0.08246476616056139,0.03766423595648112,-0.10007007276226175,0.015853764583738165,0.009048493534110191,0.007754920781114061,0.014153193048656254,-0.005046170513298061,-0.0050334599836941996,0.0012827952602642414,0.0012836183940372337,-0.012489275628461582,0.021575723344576712,0.021810162290924584,-0.13842126323925188,0.8899074931397206,False,down,False,0.010799847189411071,-0.02119006494243303,-0.031680103362109135,0.04293471991998021,0.04386974872561744,0.03215974257644408,0.03268245548607207,-0.04971769824819461,0.061738124146041004,0.0636837551599605,0.6799686556671977,0.49652430790557256,False,up,True,0.017221254567811206,-0.07360725786598388,-0.10930535088098814,0.13282826558158564,0.1420538515348071,0.09353165619650133,0.0980453627308917,-0.047435942548134546,0.06567257184301953,0.06787700691636989,1.152209332760144,0.2492350635317886,False,up,True,True,up,True,up,True,up
