RYTM_8-K_2025-04-07_0001558370-25-004507__placebo01,RYTM,2025-05-07 11:01:12,placebo,Placebo non-event control for RYTM_8-K_2025-04-07_0001558370-25-004507,non_event_control,placebo_control,placebo,,unknown,unknown,unknown,unknown,0.0,XBI,"Biotech catalyst parser candidate; review source facts, exact timestamp/session, expectation context, pipeline concentration, and materiality before modeling.",positive,high,rule_reviewed_fresh_confirmation,source_backed,reviewed,,agent_3e_rule_review=fresh_readout_with_new_result_language,RYTM_8-K_2025-04-07_0001558370-25-004507_rytm-20250407x8k;RYTM_8-K_2025-04-07_0001558370-25-004507_rytm-20250407xex99d1;RYTM_8-K_2025-04-07_0001558370-25-004507_rytm-20250407xex99d2,28,Positive Topline Results from Phase 3 Trial Evaluating,phase_3_readout,Acquired,acquired hypothalamic obesity,phase_3,,TRANSCEND,with -19,True,0.0001,,,,,,,label_expansion,approved,,,,,,True,,,True,True,False,False,False,False,False,True,True,boilerplate_or_risk_factor_not_event;endpoint_direction_unclear;publication_or_conference_notice_not_topline;requires_pipeline_concentration_review,,,,,0.78,"(“Rhythm”) issued a press release and published a corporate presentation announcing topline results from its Phase 3 TRANSCEND clinical trial evaluating setmelanotide in patients with acquired hypothalamic obesity, which are summarized under Item 8.01 below",0.76,EX-99.1 2 rytm-20250407xex99d1.htm EX-99.1 Exhibit 99.1 ​ ​ Rhythm Pharmaceuticals Announces Pivotal Phase 3 TRANSCEND Trial Meets Primary Endpoint with -19.8% Placebo-adjusted BMI Reduction in Patients (N=120) with Acquired Hypothalamic Obesity ​ -- Patients with acquired hypothalamic obesity on setmelanotide therapy (n=81) achieved mean BMI change of -16.5% compared with +3.3% for placebo (n=39) at 52 weeks (p<0.0001) -- ​ -- -19.2% placebo-adjusted BMI reduction achieved in adult patients 18 years old and older (n=49) at 52 weeks -- ​ -- -20.2% placebo-adjusted BMI reduction achieved in patients younger than 18 years old (n=71) at 52 weeks -- ​ -- Regulatory submissions in the U,0.75,Positive Topline Results from Phase 3 Trial Evaluating,0.92,"“Given these compelling new efficacy data with setmelanotide in a broader patient population than in our Phase 2 trial, we are preparing to submit a supplemental New Drug Application to the FDA and a Type II variation request to the European Medicines Agency in the third quarter of 2025. These planned submissions could pave the way for setmelanotide to become the first-ever approved therapy for these patients",0.92,"(“Rhythm”) issued a press release and published a corporate presentation announcing topline results from its Phase 3 TRANSCEND clinical trial evaluating setmelanotide in patients with acquired hypothalamic obesity, which are summarized under Item 8.01 below",0.92,Positive Topline Results from Phase 3 Trial Evaluating,0.92,"“Given these compelling new efficacy data with setmelanotide in a broader patient population than in our Phase 2 trial, we are preparing to submit a supplemental New Drug Application to the FDA and a Type II variation request to the European Medicines Agency in the third quarter of 2025. These planned submissions could pave the way for setmelanotide to become the first-ever approved therapy for these patients",,,,,,,0.92,"(“Rhythm”) issued a press release and published a corporate presentation announcing topline results from its Phase 3 TRANSCEND clinical trial evaluating setmelanotide in patients with acquired hypothalamic obesity, which are summarized under Item 8.01 below",,,0.92,​ The global trial met its primary endpoint with a highly statistically significant and clinically meaningful reduction in body mass index (BMI) with setmelanotide in both adult and pediatric patients versus placebo,0.88,"8 ® COMPLETED 52 WEEKS at therapeutic regimen (n=106) PRIMARY ANALYSIS COHORT (N=120) Vast Majority of Patients Completed Trial, Transitioned to Extension Study DISCONTINUED AE (n=7) Withdrawal (n=7) 101 PATIENTS ENROLLED IN OPEN-LABEL EXTENSION* Treatment (n=9) Placebo (n=5) *As of data cutoff, April 3, 2025. 9 ® Setmelanotide Achieved Statistically Significant and Highly Clinically Meaningful Reduction in BMI Primary analysis cohort (N=120) -19.8% Placebo-adjusted difference in BMI reduction from baseline (P<0.0001) -16.5% BMI change from baseline in Setmelanotide arm (n=81) +3.3% BMI change from baseline in Placebo arm (n=39) NOTE: Shown are the least square (LS) means for setmelanotide and placebo groups and the LS mean difference in mean percentage change from baseline in BMI at Week 52, obtained from an analysis of covariance (ANCOVA) model",,,0.76,EX-99.1 2 rytm-20250407xex99d1.htm EX-99.1 Exhibit 99.1 ​ ​ Rhythm Pharmaceuticals Announces Pivotal Phase 3 TRANSCEND Trial Meets Primary Endpoint with -19.8% Placebo-adjusted BMI Reduction in Patients (N=120) with Acquired Hypothalamic Obesity ​ -- Patients with acquired hypothalamic obesity on setmelanotide therapy (n=81) achieved mean BMI change of -16.5% compared with +3.3% for placebo (n=39) at 52 weeks (p<0.0001) -- ​ -- -19.2% placebo-adjusted BMI reduction achieved in adult patients 18 years old and older (n=49) at 52 weeks -- ​ -- -20.2% placebo-adjusted BMI reduction achieved in patients younger than 18 years old (n=71) at 52 weeks -- ​ -- Regulatory submissions in the U,,,0.7,"(Nasdaq: RYTM), a global commercial-stage biopharmaceutical company focused on transforming the lives of patients living with rare neuroendocrine diseases, today announced positive topline results from the pivotal Phase 3 TRANSCEND trial evaluating setmelanotide, a melanocortin-4 receptor (MC4R) agonist, for the treatment of acquired hypothalamic obesity",,,,,,,,,,,,,0.92,"“Given these compelling new efficacy data with setmelanotide in a broader patient population than in our Phase 2 trial, we are preparing to submit a supplemental New Drug Application to the FDA and a Type II variation request to the European Medicines Agency in the third quarter of 2025. These planned submissions could pave the way for setmelanotide to become the first-ever approved therapy for these patients",True,fresh_readout_with_new_result_language,2025-04-07,54.959999084472656,63223727.0,2025-02-28 00:00:00,https://www.sec.gov/Archives/edgar/data/1649904/000155837025001889,3474775978.036949,0.131795665778168,-0.1535924186911067,0.2853880844692747,-0.050285120116164,-0.2092493942794226,0.1589642741632586,,true,none,mid_2b_10b,True,False,False,True,RYTM_8-K_2025-04-07_0001558370-25-004507,ok,,2025-05-07,SPY,0.002542581953332706,0.8293424307546592,0.031222407039535875,120,-0.03924527912232631,0.1319152786995187,0.02551859661601427,0.10246161773933632,0.02809602804039058,0.030617097703334428,0.00420554784974847,0.006041282975249196,0.0241346392319594,0.02442823683676787,0.025961017572801587,0.026300939991956485,0.0023324604550412076,0.027828002330657388,0.028218817971287224,0.7729909869344321,0.43952771475443786,False,up,True,-0.08499438836185802,0.009914142393374181,0.015935105002439,-0.10463455487478796,-0.09934639807928947,-0.09869040049607236,-0.09397683107032284,-0.010107593247315583,-0.07866605898016274,-0.07565144919154043,-1.934853656446134,0.053008256538520815,False,down,False,0.01849784507012253,0.06093420897817681,0.07732519654760428,-0.05615245835800962,-0.054605008465410276,-0.040821008311425266,-0.0399990532390565,0.054814011433085064,-0.035035618011513725,-0.03442897607477058,-0.5687250967044871,0.5695427135304238,False,down,False,True,up,False,down,False,down
PTCT_8-K_2025-05-05_0001070081-25-000014__placebo01,PTCT,2025-06-04 11:55:12,placebo,Placebo non-event control for PTCT_8-K_2025-05-05_0001070081-25-000014,non_event_control,placebo_control,placebo,,unknown,unknown,unknown,unknown,0.0,XBI,"Biotech catalyst parser candidate; review source facts, exact timestamp/session, expectation context, pipeline concentration, and materiality before modeling.",mixed,medium,rule_reviewed_fresh_confirmation,source_backed,reviewed,,agent_3e_rule_review=fresh_readout_with_new_result_language,PTCT_8-K_2025-05-05_0001070081-25-000014_tmb-20250505x8k;PTCT_8-K_2025-05-05_0001070081-25-000014_tmb-20250505xex99d1;PTCT_8-K_2025-05-05_0001070081-25-000014_tmb-20250505xex99d2,20,PIVOT-HD Phase 2 Readout 1,phase_2_readout,EX-99,Stage 2 and Stage 3 Huntington’s disease,phase_2,,,​ - Study met primary endpoint with dose-dependent blood HTT protein lowering at Week 12 - ​ - Favorable dose-dependent trends across clinical scales in Stage 2 patients at Month 12 - ​ - Signals of dose-dependent clinic,True,0.0001,,,,,True,"​ For all dose levels and disease stages, PTC518 showed a favorable safety and tolerability profile with no treatment-related serious adverse events or neurofilament light chain protein (NfL) spikes",,,,,,,,,,,True,True,False,False,True,False,False,False,True,pipeline_table_requires_new_result;requires_pipeline_concentration_review;safety_issue_present,0.82,"​ For all dose levels and disease stages, PTC518 showed a favorable safety and tolerability profile with no treatment-related serious adverse events or neurofilament light chain protein (NfL) spikes",0.82,"​ For all dose levels and disease stages, PTC518 showed a favorable safety and tolerability profile with no treatment-related serious adverse events or neurofilament light chain protein (NfL) spikes",0.78,(NASDAQ: PTCT) today announced results from the Phase 2 PIVOT-HD study of PTC518 (votoplam) in Stage 2 and Stage 3 Huntington’s disease (HD) patients,0.86,EX-99.2 3 tmb-20250505xex99d2.htm EX-99.2 Exhibit 99.2 PTC Therapeutics PIVOT-HD Phase 2 Readout 1 Matthew B,0.75,,,,0.9,The study met its primary endpoint of reduction in blood Huntingtin (HTT) protein levels (p<0.0001) at Week 12 and favorable safety and tolerability,0.9,PIVOT-HD Phase 2 Readout 1,,,,,,,,,0.9,EX-99.2 3 tmb-20250505xex99d2.htm EX-99.2 Exhibit 99.2 PTC Therapeutics PIVOT-HD Phase 2 Readout 1 Matthew B,,,0.92,"EX-99.1 2 tmb-20250505xex99d1.htm EX-99.1 Exhibit 99.1 PTC518 PIVOT-HD Study Achieves Primary Endpoint ​ - Study met primary endpoint with dose-dependent blood HTT protein lowering at Week 12 - ​ - Favorable dose-dependent trends across clinical scales in Stage 2 patients at Month 12 - ​ - Signals of dose-dependent clinical benefit relative to matched natural history cohort as well as dose-dependent lowering of NfL in Stage 2 patients at Month 24 - ​ - Continued favorable safety and tolerability profile with no treatment-related NfL spikes - ​ - PTC will host a conference call on May 5, 2025, at 8:00 am ET - ​ ​ WARREN, N",0.88,The study met its primary endpoint of reduction in blood Huntingtin (HTT) protein levels (p<0.0001) at Week 12 and favorable safety and tolerability,,,0.76,"EX-99.1 2 tmb-20250505xex99d1.htm EX-99.1 Exhibit 99.1 PTC518 PIVOT-HD Study Achieves Primary Endpoint ​ - Study met primary endpoint with dose-dependent blood HTT protein lowering at Week 12 - ​ - Favorable dose-dependent trends across clinical scales in Stage 2 patients at Month 12 - ​ - Signals of dose-dependent clinical benefit relative to matched natural history cohort as well as dose-dependent lowering of NfL in Stage 2 patients at Month 24 - ​ - Continued favorable safety and tolerability profile with no treatment-related NfL spikes - ​ - PTC will host a conference call on May 5, 2025, at 8:00 am ET - ​ ​ WARREN, N",,,,,,,,,,,,,,,,,,,True,fresh_readout_with_new_result_language,2025-05-05,40.650001525878906,78869368.0,2025-02-27 00:00:00,https://www.sec.gov/Archives/edgar/data/1070081/000107008125000012,3206039929.545105,-0.0598982435719398,0.1220474225398029,-0.1819456661117428,-0.183570982558429,-0.1147612674150897,-0.0688097151433393,,true,negative,mid_2b_10b,True,False,False,True,PTCT_8-K_2025-05-05_0001070081-25-000014,ok,,2025-06-04,SPY,0.000829328262768941,0.9969253488202968,0.03830698407136874,120,0.05744853015922537,0.22072975186149066,0.0441944994194149,0.05620659306024536,0.010340998529697621,0.00868026145840961,-0.0002683402981673577,0.000561934944751652,0.008081027471354729,0.00811376710438827,0.008911180897655259,0.0089510036715712,0.001700373916725395,0.0069438746721304885,0.006968039269459769,0.210954416466177,0.8329228412455754,False,up,True,0.028408018946907587,0.00511669333499043,0.0076047104378946795,0.02043605348318225,0.020646299380609356,0.02290834633555448,0.023172757716953374,0.023318111744251357,0.004961595573811147,0.004973924671361818,0.3080054790454633,0.7580781632115161,False,up,True,0.003156438187942756,0.002415891213952248,0.010756278459708613,-0.007547374108744318,-0.007518964199111577,0.0007384894543963887,0.0007387622048704579,-0.0029146477206350996,0.006070370672675084,0.006088832710960279,-0.06230428501640747,0.9503205161590849,False,down,False,True,up,True,up,True,up
SMMT_8-K_2025-05-30_0001599298-25-000099__placebo01,SMMT,2025-06-30 20:17:49,placebo,Placebo non-event control for SMMT_8-K_2025-05-30_0001599298-25-000099,non_event_control,placebo_control,placebo,,unknown,unknown,unknown,unknown,0.0,XBI,"Biotech catalyst parser candidate; review source facts, exact timestamp/session, expectation context, pipeline concentration, and materiality before modeling.",mixed,high,rule_reviewed_fresh_confirmation,source_backed,reviewed,,agent_3e_rule_review=fresh_readout_with_new_result_language,SMMT_8-K_2025-05-30_0001599298-25-000099_smmt-20250530,4,"(the “Company”) announced topline results from the Phase III clinical trial, HARMONi, the first global Phase III study evaluating ivonescimab in combination with chemotherapy",phase_3_readout,,,phase_3,,,,,,,,,,,,,,,,,,,,,,False,True,False,False,False,False,False,False,True,endpoint_direction_unclear;pipeline_table_requires_new_result;requires_pipeline_concentration_review,,,,,,,,,0.75,"(the “Company”) announced topline results from the Phase III clinical trial, HARMONi, the first global Phase III study evaluating ivonescimab in combination with chemotherapy",,,0.92,"(the “Company”) announced topline results from the Phase III clinical trial, HARMONi, the first global Phase III study evaluating ivonescimab in combination with chemotherapy",0.92,"(the “Company”) announced topline results from the Phase III clinical trial, HARMONi, the first global Phase III study evaluating ivonescimab in combination with chemotherapy",,,,,,,,,0.92,"(the “Company”) announced topline results from the Phase III clinical trial, HARMONi, the first global Phase III study evaluating ivonescimab in combination with chemotherapy",,,,,,,,,,,,,,,,,,,,,,,,,,,,,True,fresh_readout_with_new_result_language,2025-05-30,18.21500015258789,742665924.0,2025-05-01 00:00:00,https://www.sec.gov/Archives/edgar/data/1599298/000159929825000089,13527659918.981829,-0.2616538266616721,-0.0401211306217736,-0.2215326960398984,-0.0682864008476238,-0.0982173392650136,0.0299309384173898,,unknown,none,large_gt_10b,False,False,False,True,SMMT_8-K_2025-05-30_0001599298-25-000099,ok,,2025-06-30,SPY,0.0007287117859274322,1.4750748206720687,0.07625332318788931,120,0.0019436797020841862,-0.24084988809137145,0.09708504509415408,0.04422055234025422,0.006283430935240724,0.03300972294095006,0.004781105489127135,0.007794615383147185,0.024712208118954936,0.02502008561359159,0.027706890122611676,0.02809429566062671,-0.0009638100354310009,0.03344087722611249,0.03400630859787568,0.324080408378579,0.7458771590226645,False,up,True,0.09805827283288382,0.009009455403626188,0.015535690549466574,0.07812716626544938,0.08126014974300677,0.08457430108426511,0.08825369965798413,0.02144318215779073,0.07232690171715549,0.07500670816877397,0.5915380286212074,0.5541599826266295,False,up,True,0.2330096673871076,0.016099881991389342,0.0313271846541765,0.17861156310130047,0.19555625579729008,0.19348641132159897,0.21347289694651916,0.06336582867739304,0.1480188771461193,0.15953478486394146,0.7407144137853167,0.45886661795899863,False,up,True,True,up,True,up,True,up
RYTM_8-K_2025-07-09_0001104659-25-066724__placebo01,RYTM,2025-08-08 20:39:20,placebo,Placebo non-event control for RYTM_8-K_2025-07-09_0001104659-25-066724,non_event_control,placebo_control,placebo,,unknown,unknown,unknown,unknown,0.0,XBI,"Biotech catalyst parser candidate; review source facts, exact timestamp/session, expectation context, pipeline concentration, and materiality before modeling.",mixed,medium,rule_reviewed_fresh_confirmation,source_backed,reviewed,,agent_3e_rule_review=fresh_readout_with_new_result_language,RYTM_8-K_2025-07-09_0001104659-25-066724_tm2520203d1_8k;RYTM_8-K_2025-07-09_0001104659-25-066724_tm2520203d1_ex99-1;RYTM_8-K_2025-07-09_0001104659-25-066724_tm2520203d1_ex99-2,24,"Bivamelagon Achieved Statistically Significant, Clinically Meaningful BMI Reductions in Placebo-controlled Phase 2 Trial in Acquired Hypothalamic",phase_2_readout,Acquired,acquired hypothalamic obesity,phase_2,,TRANSCEND,,,0.0105,,,,,True,"During the placebo-controlled portion of the trial, one patient discontinued therapy due to a serious adverse event (rectal bleeding)",,,,,,,,,,,False,True,False,False,True,False,False,False,True,boilerplate_or_risk_factor_not_event;endpoint_direction_unclear;publication_or_conference_notice_not_topline;requires_pipeline_concentration_review;safety_issue_present,0.82,"During the placebo-controlled portion of the trial, one patient discontinued therapy due to a serious adverse event (rectal bleeding)",0.82,"During the placebo-controlled portion of the trial, one patient discontinued therapy due to a serious adverse event (rectal bleeding)",0.78,"(“Rhythm”) issued a press release and published a corporate presentation announcing topline results from its Phase 2 trial evaluating bivamelagon (formerly LB54640), an investigational oral melanocortin-4 receptor (“MC4R”) agonist, in patients with acquired hypothalamic obesity, which are summarized under Item 8.01 below",0.76,"® July 9, 2025 Rhythm Pharmaceuticals Positive Topline Results from Phase 2 Trial Evaluating Oral MC4R Agonist Bivamelagon in Patients with Acquired Hypothalamic Obesity 2 ® This presentation and the accompanying oral presentation contain forward - looking statements within the meaning of the Private Se curities Litigation Reform Act of 1995. All statements contained in this presentation that do not relate to matters of historical fact should be considered for war d - looking statements, including without limitation statements regarding our Phase 2 study to assess the efficacy and safety of bivamelagon in patients with acquired hypothalamic obesity and the potential for bivamelagon to treat hypothalamic obesity",0.75,"® July 9, 2025 Rhythm Pharmaceuticals Positive Topline Results from Phase 2 Trial Evaluating Oral MC4R Agonist Bivamelagon in Patients with Acquired Hypothalamic Obesity",,,0.9,"Bivamelagon Achieved Statistically Significant, Clinically Meaningful BMI Reductions in Placebo-controlled Phase 2 Trial in Acquired Hypothalamic",0.9,"Bivamelagon Achieved Statistically Significant, Clinically Meaningful BMI Reductions in Placebo-controlled Phase 2 Trial in Acquired Hypothalamic",,,,,,,,,0.9,"® July 9, 2025 Rhythm Pharmaceuticals Positive Topline Results from Phase 2 Trial Evaluating Oral MC4R Agonist Bivamelagon in Patients with Acquired Hypothalamic Obesity 2 ® This presentation and the accompanying oral presentation contain forward - looking statements within the meaning of the Private Se curities Litigation Reform Act of 1995. All statements contained in this presentation that do not relate to matters of historical fact should be considered for war d - looking statements, including without limitation statements regarding our Phase 2 study to assess the efficacy and safety of bivamelagon in patients with acquired hypothalamic obesity and the potential for bivamelagon to treat hypothalamic obesity",,,,,0.88,"Percentage Change in BMI,% * * 13 ® Patients Achieved BMI Reductions of at least 5%, 10% at Week 14 0.0 % 16.7 % 71.4 % 75.0 % 0.0 % 0.0 % 14.3 % 37.5 % 0 10 20 30 40 50 60 70 80 90 100 Placebo (N=7) 200mg BIVA (N=6) 400mg BIVA (N=7) 600mg BIVA (N=8) Achieved a >=5% Reduction Achieved a >=10% Reduction 1 1. P=0.0105 2. P= 0.0056 vs placebo 2 Percentage of patients achievi",,,,,,,0.7,"As previously announced, Rhythm will present results from this trial in a poster accepted as a late-breaking abstract and data from Rhythm’s pivotal Phase 3 TRANSCEND trial evaluating setmelanotide in both a live oral presentation and a poster at The Endocrine Society’s Annual Meeting (ENDO 2025) on July 12, 2025 in San Francisco",,,,,,,,,,,,,,,True,fresh_readout_with_new_result_language,2025-07-09,89.0,63621472.0,2025-05-07 00:00:00,https://www.sec.gov/Archives/edgar/data/1649904/000155837025006765,5662311008.0,0.3339328293115111,0.0428084687539414,0.2911243605575697,0.5389935532079999,0.2271676562037683,0.3118258970042316,,unknown,negative,mid_2b_10b,False,False,False,True,RYTM_8-K_2025-07-09_0001104659-25-066724,ok,,2025-08-08,SPY,0.0026536270594960734,0.6813407939684107,0.04040975632223919,120,0.08163891730212341,0.03790672397359706,0.01756730348942079,0.010222189548238485,0.006405168715053694,-0.005406574198210334,0.007797572699558275,0.0079774768405112,-0.013367067610251693,-0.013278125103225236,-0.013188571362397337,-0.013101983231016412,0.0012892351378765987,-0.0067096474028266444,-0.006687187978371645,-0.330788127096308,0.7408045297139481,False,down,False,0.04303628441899976,0.016512426718257256,0.01930354378314858,0.023016370057122565,0.023283290616029184,0.025758384909269204,0.026092998967433445,0.01875287006482318,0.023556761115961087,0.023836413194724404,0.32884403811498686,0.7422735749053697,False,up,True,0.09948093224795951,0.005219410537227853,0.030540291386125906,0.06475496920483562,0.06689756959342663,0.0896323520340028,0.09377208669334669,0.05391463604953062,0.04232673228552014,0.04323528171999658,0.5067419631744914,0.6123358828055072,False,up,True,False,down,True,up,True,up
