KRYS_8-K_2023-05-19_0001711279-23-000037__placebo01,KRYS,2023-06-20 21:05:17,placebo,Placebo non-event control for KRYS_8-K_2023-05-19_0001711279-23-000037,non_event_control,placebo_control,placebo,,unknown,unknown,unknown,unknown,0.0,XBI,"Biotech catalyst parser candidate; review source facts, exact timestamp/session, expectation context, pipeline concentration, and materiality before modeling.",positive,medium,rule_reviewed_fresh_confirmation,source_backed,reviewed,,agent_3e_rule_review=fresh_regulatory_approval_language,KRYS_8-K_2023-05-19_0001711279-23-000037_a991pressreleasekrystalbio;KRYS_8-K_2023-05-19_0001711279-23-000037_exhibit992toformfdaapprova;KRYS_8-K_2023-05-19_0001711279-23-000037_krys-20230519,18,"“For so many years, all we have been able to offer DEB patients was palliative care, but now, based on the strength of the Company’s clinical trial data, there is a safe and effective FDA approved treatment",fda_approval,Our,patients six months of age or older with either recessive or dominant Dystrophic Epidermolysis Bullosa,phase_3,,GEM-3,"complete wound healing at six months and its key secondary endpoint of complete wound healing at three months •Rare Pediatric Disease Priority Review Voucher granted •Company to host investor conference call on Friday, M",True,,,,,,True,VYJUVEK was well tolerated with no drug-related serious adverse events or discontinuations due to treatment-related events,approval,approved,,,,,,,,,True,False,True,False,True,True,False,False,True,boilerplate_or_risk_factor_not_event;pipeline_table_requires_new_result;requires_pipeline_concentration_review;safety_issue_present,0.82,VYJUVEK was well tolerated with no drug-related serious adverse events or discontinuations due to treatment-related events,0.82,VYJUVEK was well tolerated with no drug-related serious adverse events or discontinuations due to treatment-related events,0.78,Food and Drug Administration (“FDA”) approval of VYJUVEKTM (beremagene geperpavec-svdt) for the treatment of patients six months of age or older with either recessive or dominant Dystrophic Epidermolysis Bullosa,0.76,"htm EX-99.2 Document Exhibit 99.2 Updated Risk Factors Risks Related to Our Business We have limited experience as a commercial company and the sales, marketing, and distribution of VYJUVEK or any future approved products may be unsuccessful or less successful than anticipated",0.75,Food and Drug Administration (“FDA”) approval of VYJUVEKTM (beremagene geperpavec-svdt) for the treatment of patients six months of age or older with either recessive or dominant Dystrophic Epidermolysis Bullosa,0.94,"“For so many years, all we have been able to offer DEB patients was palliative care, but now, based on the strength of the Company’s clinical trial data, there is a safe and effective FDA approved treatment",0.94,"“For so many years, all we have been able to offer DEB patients was palliative care, but now, based on the strength of the Company’s clinical trial data, there is a safe and effective FDA approved treatment",0.94,"“For so many years, all we have been able to offer DEB patients was palliative care, but now, based on the strength of the Company’s clinical trial data, there is a safe and effective FDA approved treatment",0.94,"“For so many years, all we have been able to offer DEB patients was palliative care, but now, based on the strength of the Company’s clinical trial data, there is a safe and effective FDA approved treatment",,,,,,,0.92,", clinic) or a home setting •Data from the pivotal Phase 3 (GEM-3) trial, published in the New England Journal of Medicine, demonstrated that the trial met its primary endpoint of complete wound healing at six months and its key secondary endpoint of complete wound healing at three months •Rare Pediatric Disease Priority Review Voucher granted •Company to host investor conference call on Friday, May 19, 2023 at 6:00 pm ET PITTSBURGH, May 19, 2023 (GLOBE NEWSWIRE) – Krystal Biotech, Inc",,,0.92,", clinic) or a home setting •Data from the pivotal Phase 3 (GEM-3) trial, published in the New England Journal of Medicine, demonstrated that the trial met its primary endpoint of complete wound healing at six months and its key secondary endpoint of complete wound healing at three months •Rare Pediatric Disease Priority Review Voucher granted •Company to host investor conference call on Friday, May 19, 2023 at 6:00 pm ET PITTSBURGH, May 19, 2023 (GLOBE NEWSWIRE) – Krystal Biotech, Inc",,,,,0.76,", clinic) or a home setting •Data from the pivotal Phase 3 (GEM-3) trial, published in the New England Journal of Medicine, demonstrated that the trial met its primary endpoint of complete wound healing at six months and its key secondary endpoint of complete wound healing at three months •Rare Pediatric Disease Priority Review Voucher granted •Company to host investor conference call on Friday, May 19, 2023 at 6:00 pm ET PITTSBURGH, May 19, 2023 (GLOBE NEWSWIRE) – Krystal Biotech, Inc",,,0.7,", clinic) or a home setting •Data from the pivotal Phase 3 (GEM-3) trial, published in the New England Journal of Medicine, demonstrated that the trial met its primary endpoint of complete wound healing at six months and its key secondary endpoint of complete wound healing at three months •Rare Pediatric Disease Priority Review Voucher granted •Company to host investor conference call on Friday, May 19, 2023 at 6:00 pm ET PITTSBURGH, May 19, 2023 (GLOBE NEWSWIRE) – Krystal Biotech, Inc",,,,,,,,,,,,,,,True,fresh_regulatory_approval_language,2023-05-19,96.05999755859376,25799738.0,2023-05-08 00:00:00,https://www.sec.gov/Archives/edgar/data/1711279/000171127923000029,2478322769.292359,0.1060448963302744,0.0376811261804661,0.0683637701498083,0.2277607385144895,0.0227627894752802,0.2049979490392093,,true,negative,mid_2b_10b,True,False,True,False,KRYS_8-K_2023-05-19_0001711279-23-000037,ok,,2023-06-20,SPY,0.003525087856680953,0.6965864508457876,0.03399182721515261,120,-0.059771708993080666,0.3283531671836885,0.05375530762677895,0.05083463980304029,0.007143196976847598,0.027420900318796182,-0.005188046556678594,-9.8237406271795e-05,0.027149923998711672,0.027521841399382962,0.032253232965770595,0.03277900588408311,-0.00030796815994182936,0.027359697358704003,0.027737410718078337,0.7987191693716597,0.42445326891819635,False,up,True,-0.01226947845198667,-0.006712754197026105,0.00590082658301716,-0.01822885479993818,-0.01806371419012265,-0.005609983837531293,-0.005594277263137992,-0.012285129871135503,1.584596487972604e-05,1.5846090427595882e-05,-0.3096166075200397,0.7568525255254055,False,down,False,-0.03746708630011053,0.009853046568182089,0.042978731966692996,-0.08026780195254365,-0.07713083287432987,-0.04799183917293392,-0.046858434530749116,-0.05391988785759427,0.0172410110228428,0.017390495103238424,-0.7467356059994288,0.45522317242553445,False,down,False,True,up,True,flat,True,up
PTCT_8-K_2023-05-23_0001104659-23-063688__placebo01,PTCT,2023-06-22 21:17:08,placebo,Placebo non-event control for PTCT_8-K_2023-05-23_0001104659-23-063688,non_event_control,placebo_control,placebo,,unknown,unknown,unknown,unknown,0.0,XBI,"Biotech catalyst parser candidate; review source facts, exact timestamp/session, expectation context, pipeline concentration, and materiality before modeling.",negative,high,rule_reviewed_fresh_confirmation,source_backed,reviewed,,agent_3e_rule_review=fresh_readout_with_new_result_language,PTCT_8-K_2023-05-23_0001104659-23-063688_tm2316598d1_8k;PTCT_8-K_2023-05-23_0001104659-23-063688_tm2316598d1_ex99-1;PTCT_8-K_2023-05-23_0001104659-23-063688_tm2316598d1_ex99-2;PTCT_8-K_2023-05-23_0001104659-23-063688_tm2316598d1_ex99-3,22,Corporate Presentation – Move FA Topline Results,phase_3_readout,EX-99,Friedreich ataxia and Angelman syndrome as well as several other programs targeting rare CNS and ophthalmological disorder,phase_3,,MOVE-FA,Change in mFARS Score Open - Label Extension Placebo - Controlled Vatiquinone Placebo 72 weeks R 24 weeks Vatiquinone Primary Endpoint Primary Analysis Population: 7 - 21 years old Overall Enrolled Population: included p,False,0.14,,,,,,,,,,,,,,,,,True,True,False,False,False,False,True,False,True,boilerplate_or_risk_factor_not_event;endpoint_direction_unclear;pipeline_table_requires_new_result;requires_pipeline_concentration_review,,,,,0.78,The discontinued gene therapy programs include preclinical stage programs in Friedreich ataxia and Angelman syndrome as well as several other programs targeting rare CNS and ophthalmological disorders of high unmet medical need at various stages of preclinical development,0.86,"EX-99.1 2 tm2316598d1_ex99-1.htm EXHIBIT 99.1 Exhibit 99.1 PTC Therapeutics Announces Strategic Pipeline Prioritization - Preclinical and early research gene therapy programs discontinued - - Expected reductions of approximately 15% in residual 2023 OPEX - SOUTH PLAINFIELD, N",0.75,Corporate Presentation – Move FA Topline Results,,,0.92,Corporate Presentation – Move FA Topline Results,0.92,Corporate Presentation – Move FA Topline Results,,,,,,,,,0.92,"About the MOVE-FA Clinical Trial The Phase 3 registration-directed trial in Friedreich Ataxia patients, called MOVE-FA, is a randomized, placebo-controlled 72-week trial with the primary endpoint being change in the modified Friedreich Ataxia Rating Scale (mFARS) score",,,0.92,The study did not meet its primary endpoint of statistically significant change in mFARS score at 72 weeks in the primary analysis population,0.88,The mean placebo corrected change in the mFARS score in the primary analysis population was 1.6 (p=0.14),,,0.76,MOVE - FA Topline Results MOVE - FA Is a Global Registration - Directed Trial of Vatiquinone in Friedreich Ataxia Patients MOVE - FA Topline Results 3 Primary Endpoint Change in mFARS Score Open - Label Extension Placebo - Controlled Vatiquinone Placebo 72 weeks R 24 weeks Vatiquinone Primary Endpoint Primary Analysis Population: 7 - 21 years old Overall Enrolled Population: included patients over age 21 Other Endpoints FARS - ADL Scale Upright Stability Subscale Modified Fatigue Impact Scale mFARS Disease Rating Scale Measures Disease Progression Across Four Domains MOVE - FA Topline Results 4 mFARS scores worsen (increase) on average by 2 to 3 points per year in pediatric patients based on natural history studies 1 Bulbar Upright stability Lower limb coordination Upper limb coordination 1 Rummey,,,0.7,(NASDAQ: PTCT) today reported topline results from the MOVE-FA trial of vatiquinone in patients with Friedreich ataxia,,,,,,,,,,,,,,,True,fresh_readout_with_new_result_language,2023-05-23,58.40999984741211,74190700.0,2023-04-27 00:00:00,https://www.sec.gov/Archives/edgar/data/1070081/000107008123000028,4333478775.679398,0.1408202925202206,0.093488213756151,0.0473320787640696,0.3844513332227233,0.0652622542479839,0.3191890789747393,,false,none,mid_2b_10b,True,False,False,True,PTCT_8-K_2023-05-23_0001104659-23-063688,ok,,2023-06-22,SPY,-8.94134552210591e-05,1.07842908196666,0.032240663085625856,120,-0.02318474810038345,-0.3166363747647422,0.056632767070155215,0.041546077361559415,0.0074817096326053175,-0.02647476005546101,0.0036096601158854824,0.003803555303145467,-0.03062786757223122,-0.030163586489253436,-0.030434688423689533,-0.02997621621923474,-0.006539798425735155,-0.020270250895041475,-0.020066190470575784,-0.9499763541118457,0.34212426765598014,False,down,False,-0.06177426294886368,-0.008047021325761405,-0.008941274161581858,-0.0547832138553845,-0.053309644938130174,-0.05568512774162586,-0.05416309318906387,-0.04577788498117641,-0.016905891426275473,-0.01676378876145801,-0.9810314131095077,0.32657725087863154,False,down,False,-0.024849039960503028,0.01085208101010049,0.010803964722709836,-0.03590900804502047,-0.035271928017212795,-0.035956608909174854,-0.03531784881416977,-0.062413908626037906,0.039283705395265926,0.04006551399507896,-0.35220818392597436,0.7246821398201169,False,down,False,False,down,False,down,True,up
SGMO_8-K_2023-11-03_0001628280-23-036697__placebo01,SGMO,2023-12-04 20:02:28,placebo,Placebo non-event control for SGMO_8-K_2023-11-03_0001628280-23-036697,non_event_control,placebo_control,placebo,,unknown,unknown,unknown,unknown,0.0,XBI,"Biotech catalyst parser candidate; review source facts, exact timestamp/session, expectation context, pipeline concentration, and materiality before modeling.",negative,medium,rule_reviewed_fresh_confirmation,source_backed,reviewed,,agent_3e_rule_review=fresh_safety_negative_language,SGMO_8-K_2023-11-03_0001628280-23-036697_sgmo-20231102,9,•Treatment-related serious adverse events were reported in one participant in the highest dose cohort who experienced hypotension and fever with onset approximately six hours after giroctocogene fitelparvovec infusion,safety_signal,SB-525,moderately severe to severe hemophilia A and is the subject of our Phase 1/2 Alta study and the registrational Phase 3 AFFINE clinical trial,phase_3,,AFFINE,,,,,,,,True,•Treatment-related serious adverse events were reported in one participant in the highest dose cohort who experienced hypotension and fever with onset approximately six hours after giroctocogene fitelparvovec infusion,,,,,,,,,,,True,False,False,False,True,False,False,False,True,pipeline_table_requires_new_result;publication_or_conference_notice_not_topline;requires_pipeline_concentration_review;safety_issue_present,0.82,•Treatment-related serious adverse events were reported in one participant in the highest dose cohort who experienced hypotension and fever with onset approximately six hours after giroctocogene fitelparvovec infusion,0.82,•Treatment-related serious adverse events were reported in one participant in the highest dose cohort who experienced hypotension and fever with onset approximately six hours after giroctocogene fitelparvovec infusion,0.78,"Giroctocogene fitelparvovec, also known as SB-525, is a gene therapy product candidate for the treatment of moderately severe to severe hemophilia A and is the subject of our Phase 1/2 Alta study and the registrational Phase 3 AFFINE clinical trial",0.86,"Giroctocogene fitelparvovec, also known as SB-525, is a gene therapy product candidate for the treatment of moderately severe to severe hemophilia A and is the subject of our Phase 1/2 Alta study and the registrational Phase 3 AFFINE clinical trial",0.75,•Treatment-related serious adverse events were reported in one participant in the highest dose cohort who experienced hypotension and fever with onset approximately six hours after giroctocogene fitelparvovec infusion,,,0.86,•Treatment-related serious adverse events were reported in one participant in the highest dose cohort who experienced hypotension and fever with onset approximately six hours after giroctocogene fitelparvovec infusion,0.86,•Treatment-related serious adverse events were reported in one participant in the highest dose cohort who experienced hypotension and fever with onset approximately six hours after giroctocogene fitelparvovec infusion,,,,,,,,,0.92,"Giroctocogene fitelparvovec, also known as SB-525, is a gene therapy product candidate for the treatment of moderately severe to severe hemophilia A and is the subject of our Phase 1/2 Alta study and the registrational Phase 3 AFFINE clinical trial",,,,,,,,,,,,,0.7,"We and Pfizer plan to present updated data, of which a summary of the accepted abstract is located below, from the Phase 1/2 Alta study in a platform presentation at the 65th American Society of Hematology Annual Meeting & Exposition on December 11, 2023. Pfizer expects a pivotal readout in the Phase 3 AFFINE trial evaluating giroctocogene fitelparvovec in the middle of 2024. Summary of Updated Preliminary Results from the Phase 1/2 Alta Study of Giroctocogene Fitelparvovec •Alta is a Phase 1/2 single-dose multicenter dose-ranging study to assess the safety and tolerability of giroctocogene fitelparvovec in adults with severe hemophilia A",,,,,,,,,,,,,,,True,fresh_safety_negative_language,2023-11-03,0.4600000083446502,177346980.0,2023-11-01 00:00:00,https://www.sec.gov/Archives/edgar/data/1001233/000162828023035989,81579612.27989851,-0.1636363665919659,-0.0106604711458676,-0.1529758954460982,-0.5740740832723215,-0.1060794467264037,-0.4679946365459176,,unknown,negative,micro_lt_300m,True,False,False,False,SGMO_8-K_2023-11-03_0001628280-23-036697,ok,,2023-12-04,SPY,-0.010185454863124407,1.492970850158272,0.06366973828266788,120,0.16907631610132673,-0.021978951350272766,0.0780897496451741,0.06371695044940089,0.006094972944628484,0.06666667108182556,-0.00524936741162263,-0.017881444901067356,0.08258177498486485,0.08608748459535631,0.06980171902508978,0.0722955443680593,0.0174741197971664,0.04721532235442693,0.04834771747753708,1.297033366435954,0.19461970649287252,False,up,True,-1.1102230246251565e-16,-0.009453181807926203,-0.04375088639183322,0.04473682078752897,0.04575260334281528,0.009498146729825588,0.009543397277455234,0.021971009836669886,-0.021733125270253433,-0.021498662511161948,0.4056686303577754,0.6849860944359398,False,up,True,-0.06666667108182578,0.026427473726245543,-0.0609733768721451,-0.006081428680499667,-0.006062974221877404,-0.09507717725399042,-0.09069724572951177,0.10137500511223041,-0.165552280063916,-0.15257444141555832,-0.030204562759269974,0.9759039096375097,False,down,False,True,up,False,down,False,down
ROIV_8-K_2023-11-27_0001140361-23-054630__placebo01,ROIV,2023-12-27 13:06:05,placebo,Placebo non-event control for ROIV_8-K_2023-11-27_0001140361-23-054630,non_event_control,placebo_control,placebo,,unknown,unknown,unknown,unknown,0.0,XBI,"Biotech catalyst parser candidate; review source facts, exact timestamp/session, expectation context, pipeline concentration, and materiality before modeling.",negative,high,rule_reviewed_fresh_confirmation,source_backed,reviewed,,agent_3e_rule_review=fresh_readout_with_new_result_language,ROIV_8-K_2023-11-27_0001140361-23-054630_ef20015420_8k;ROIV_8-K_2023-11-27_0001140361-23-054630_ef20015420_ex99-1,11,Oral brepocitinib failed to meet its primary endpoint of Systemic Lupus Erythematosus Responder Index (SRI-4) change of 4 at Week 52,phase_3_readout,SRI-4,psoriasis and in development for the treatment of atopic dermatitis,phase_3,,,,False,,,,,,,,,,,,,,,,,,True,True,False,False,False,False,True,False,True,boilerplate_or_risk_factor_not_event;pipeline_table_requires_new_result;requires_pipeline_concentration_review,,,,,0.78,"Today, Roivant’s pipeline includes VTAMA®, a novel topical approved for the treatment of psoriasis and in development for the treatment of atopic dermatitis",0.86,"“We saw some of the highest SRI-4 responder rates ever observed in a lupus study in the active arm of this trial, along with a favorable safety and tolerability profile",0.75,Oral brepocitinib failed to meet its primary endpoint of Systemic Lupus Erythematosus Responder Index (SRI-4) change of 4 at Week 52,,,0.92,Oral brepocitinib failed to meet its primary endpoint of Systemic Lupus Erythematosus Responder Index (SRI-4) change of 4 at Week 52,0.92,Oral brepocitinib failed to meet its primary endpoint of Systemic Lupus Erythematosus Responder Index (SRI-4) change of 4 at Week 52,,,,,,,,,0.92,"” Priovant expects to announce topline results from its own studies, the Phase 2 POC study of brepocitinib in non-infectious uveitis (NIU) in the first quarter of calendar year 2024 and the Phase 3 trial in dermatomyositis (DM) in calendar year 2025. Oral brepocitinib has demonstrated statistically significant clinically meaningful benefit in six completed placebo-controlled Phase 2 studies in psoriasis, psoriatic arthritis, alopecia areata, hidradenitis suppurativa, ulcerative colitis, and Crohn’s disease",,,0.92,issued a press release announcing that its subsidiary Priovant’s Phase 2 study evaluating oral brepocitinib in adult patients with moderate to severe active lupus did not meet its primary endpoint,,,,,,,,,,,,,,,,,,,,,,,,,True,fresh_readout_with_new_result_language,2023-11-27,9.100000381469728,803921356.0,2023-11-13 00:00:00,https://www.sec.gov/Archives/edgar/data/1635088/000114036123052721,7315684646.271661,0.0859188851069421,0.1420773364809486,-0.0561584513740065,-0.2134830923512845,-0.0753788646205659,-0.1381042277307185,,false,none,mid_2b_10b,True,False,False,True,ROIV_8-K_2023-11-27_0001140361-23-054630,ok,,2023-12-27,SPY,-3.621851895401313e-05,0.9827693179741805,0.03660889045159374,120,0.05005516856298608,0.23146049897935383,0.03136638586335383,0.0495745915665467,0.005890376060168886,0.00959020524118448,0.0018080695834519211,0.0017406054309363483,0.007805418801664749,0.007835960494854133,0.007738074141280582,0.007768090409741246,0.015314318220608136,-0.005653726544159262,-0.005637774309590671,0.21321101801720807,0.8311623747146766,False,up,True,-0.020924212659556574,-0.0007148948648344478,-0.0008111543858712045,-0.020334742884523693,-0.020129386313678554,-0.020431075910105713,-0.020223775668094857,-0.0019002311360675206,-0.019244187568442386,-0.019060200309577002,-0.3206944852318101,0.7484419268849392,False,down,False,-0.026155203465620835,0.0019131546456565562,0.0015173582654466333,-0.028019542751123547,-0.0276306361569153,-0.028414661406658027,-0.028014761540089972,0.03431714392182794,-0.06024477916087944,-0.05846596253655367,-0.24203294062454567,0.8087546389702738,False,down,False,False,down,False,down,False,down
